{
  "id": "skills/context-summarization",
  "version": "1.0.0",
  "lifecycle": "active",
  "type": "skill",
  "model": null,
  "description": "Compress conversation history when context utilization approaches 40% and write a structured summary to memory/",
  "owners": ["gbrett"],
  "artifacts": {
    "source": "skills/context-summarization.md",
    "fixture-prefix": null,
    "evals": null,
    "expected": null
  }
}
