{
  "id": "commands/apply-fixes",
  "version": "1.0.0",
  "lifecycle": "active",
  "type": "command",
  "model": null,
  "description": "Apply correction prompts generated by /code-review to fix issues found in a review pass",
  "owners": ["gbrett"],
  "artifacts": {
    "source": "commands/apply-fixes.md",
    "fixture-prefix": null,
    "evals": null,
    "expected": null
  }
}
