{
  "id": "skills/beads",
  "version": "1.0.0",
  "lifecycle": "active",
  "type": "skill",
  "model": null,
  "description": "Structured task tracking with git-backed, dependency-aware issue graph that persists across sessions",
  "owners": ["gbrett"],
  "artifacts": {
    "source": "skills/beads.md",
    "fixture-prefix": null,
    "evals": null,
    "expected": null
  }
}
